1521,"Ciao Alex,
innanzitutto...wow... grazie mille per le belle parole!!!:blush: :) 
Detto ciò, veniamo al dunque: non c'è paragone, 100 volte meglio una bella bici che una spider!!! B) :woohoo: :woohoo: 

La Fuji Touring, nonostante sia una ""entry level"" è, a mio parere, un'ottima bici da viaggio! 
Cambio deore 9 velocità, acciaio, un peso tutto sommato buono... non ha nulla da invidiare ad altre più blasonate.
La scelta tra freni a disco o V-brake è francamente soggettiva ma ti do una mia personale opinione: io non tornerei più indietro. I freni a disco meccanici sono di semplice utilizzo e manutenzione come i V-brake (e quindi molto meno ""impegnativi"" dei freni a disco idraulici) ma hanno una frenata decisamente più reattiva. 
Detto questo, per viaggi non troppo impegnativi dal punto di vista altimetrico come penso sarà il tuo Bristol-Parigi, la differenza praticamente non si sente. La domanda che ti devi porre è: utilizzerò la bici carica anche su salite (e quindi discese) medio-lunghe per cui servano freni più performanti? Se la risposta è sì ti consiglio di fare l'investimento altrimenti non ne vale la pena.
Per quanto riguarda la Hobo, se non è la Geo, è proprio l'ammiraglia di Cinelli per quanto riguarda i viaggi e quindi non è una bici ""corsaiola"" ma una bici pensata per i lunghi viaggi, del tutto simile alla fuji touring anche se con una geometria leggermente più compatta.

Buona scelta e, soprattutto,
buoni viaggi!!! ;)"
1522,"Sto progettando l’itinerario da Praga a Berlino passando per Dresda. Avete consigli di posti da visitare, di percorso già sperimentato, di posti dove pernottare , ecc. grazie."
1523,"Grazie Leo!
In realtà oltre freni ci sono anche un pò di differenze di componentistica: deore 9v contro deore xt 10v, deragliatore alivio contro deore tra le più evidenti.
Per quello che riguarda le salite e discese.... chissà! Spero che questo sia il primo di una lunga serie di viaggi, che non so dove mi porteranno. Certo, con la differenza potrei fare già una serie di upgrade come sella, borse, etc...
A proposito, vedo che non avete ancora affrontato il problema selle! Vedo che è molto dibattuto altrove, con talebani Brooks e amanti Smp principalmente.
Già che ci sono vi faccio un'altra domanda logistica: che tipo di luccheto vi portate dietro? Io ho vissuto molti anni a milano e quindi sono parecchio sensibile all'argomento. Per esperienza so che il lucchetto deve essere possibilmente un U-lock e bello sodo, cosa che chiaramente porta 1,5kg di peso e anche più. Con tutte le attenzioni che si fanno per la riduzione di peso, che stratagemmi avete?"
1524,"Ciao a tutti, complimenti per il sito davvero fatto bene ed esaustivo..mi attacco a questa conversazione perché anch'io son nella stessa situazione..vorrei acquistare una bici budget diciamo inferiore alle 400euro, abito nella zona della brianza milanese e vicino a casa mia ci son un sacco di ciclabili e sentieri sterrati quindi opterei per una bici da trekking vorrei optare per una che ha il portapacchi perché vorrei vedere se riesco a mettere la mia cagnolino con me.. ho già visto qualche bici come la Lombardo mirafiori o taranto ,la atala discoveryman 21 , e la bianchi spillo rubino...diciamo che non mi sembrano male ma io non me ne intendo molto e vorrei avvicinarmi a questa piacevole avventura senza spendere cifre esasperate..per caso mi potete consigliare tra quelle elencate oppure altre...grazie mille gentilissimi..."
1525,"Ciao Climber82,
grazie per i complimenti.
Per quanto riguarda le bici da te elencate, sono tutte davvero molto simili:
telaio in alluminio, freni V-brake, guarnitura tripla (in realtà le Lombardo e la Discovery hanno il 42-24 mentre Bianchi monta il 48-28, che in parole molto spicciole significa rapporti più lunghi e duri e quindi più adatti alla pianura e meno alla salita), pignoni a 7 velocità a parte la Taranto, con il 14-28 (per intenderci le MTB montano 9-10 velocità o addirittura 11 se hanno una sola corona davanti). Non sono invece riuscito a fare un confronto sui pesi che non ho trovato ma che alla fine conta davvero poco in questa scelta (1kg in più o in meno non ha grossa importanza).

In definitiva sono bici discrete che vanno bene per fare pianura o qualche collina ma che non ti consiglio se vuoi fare anche qualche salita, a meno che tu non sia ben allenata. Tra le quattro, le Lombardo montano dei copertoncini più grossi e quindi più adatti se ci vuoi fare anche qualche sterrato tipo la ciclovia dell'Adda ad esempio. La Taranto, che in effetti costa qualcosina in più, ha 8 velocità al posteriore ed il pignone più grande è un 32 denti che significa anche più agilità nella pedalata e quindi più facilità in salita.
Come già detto in questa conversazione, a mio parere potresti pensare ad una Riverside 500 (o 900 se vuoi qualcosina in più) decathlon su cui fai montare il portapacchi posteriore (ha la predisposizione) per metterci una cassettina per il cagnolino!"
1526,"Ciao Leo e grazie mille per il consiglio e l esaustiva spiegazione.. Vorrei chiederti un paio di consigli ancora
- Avevo già visto una bici ibrida tipo riverside o altre di quel genere ma optavo su quelle tipo lombardo Taranto o simili perché facendo già arrampicata e molte camminate in montagna,la bici sarebbe in alternativa a quando stiamo in zona vicino a casa quindi non ci sono molte salite ma più sterrato e asfalto..infine se dovessi prendere tu mi consiglieresti là lombardo Taranto piuttosto che atala o bianchi??
- non mi puoi dare un link o altro dove poter vedere differenze tra freni e componentistica senza disturbarvi sempre..
Grazie mille ancora per l aiuto"
1527,"immagino tu intenda le differenze tra Fuji Touring e Touring Disc... beh allora i 180€ sono più giustificati... soprattutto considerando il deore XT 10v vs il 9v... se credi e speri che questo sia il primo di una lunga serie di viaggi io ti consiglierei di partire già col piede giusto sulla bici magari aspettando invece a fare l'upgrade di componenti e accessori per viaggi futuri però, ripeto, sono scelte molto personali.

Il problema sella è, come dire, un reale problema da affrontare cercando di essere il più obiettivi possibile... abbiamo scritto un paio di articoli ma effettivamente è uno dei componenti più difficile da consigliare perché cambia moltissimo a seconda del singolo. Ti devo dire la verità: personalmente credo che Brooks siano ottime soprattutto perché raramente chi le ha si lamenta, ma non ho esperienza a riguardo e costano davvero tanto! 
Io e Vero abbiamo la fortuna di non avere grossi problemi di adattamento e abbiamo sempre usato le selle uscite di serie con la bici (sia sulle MTB Viner usate fino a 2 anni fa che sulle Hobogeo ed ora Vero sulla Genesis). 

Infine argomento lucchetto: abbiamo girato per 20 anni senza praticamente legare mai le bici quando eravamo in giro per il mondo e siamo stati fortunati ma non abbiamo mai subito un furto. Da 3-4 anni a questa parte giriamo con un semplice lucchetto di cavo spiralato con chiave (che a breve dovremo cambiare perché la serratura inizia a scricchiolare)... peserà 4-500g e quindi non pochissimo ma nemmeno eccessivamente. Come dici tu, l'ideale sarebbe un U-lock ma è ingombrante e pesante e meno duttile nel permetterti di legare la bici dove vuoi. In definitiva secondo me se usi un po' di accortezza nelle città il lucchetto in viaggio rappresenta più un deterrente che un reale antifurto: uno che vede una bici stracarica e quindi pesante, legata con un qualsiasi lucchetto, difficilmente punterà sul tuo mezzo e cercherà qualcosa di più abbordabile... o perlomeno mi piace pensarla così:=)!"
1528,"Ciao,
dato il tuo ragionamento la Lombardo Taranto mi sembra più che valida e un buon compromesso. Di certo è quella, tra le quattro che mi hai indicato, più versatile ed è giustificata la differenza di 60-70€ con le altre.
Per quanto riguarda i link... basta cercare il sito ufficiale e lì cercare la bici... solitamente ci sono sempre le specifiche tecniche sotto la foto.
Qui la Taranto:
https://www.lombardobikes.com/it/elenco-bici/taranto-woman/
Qui la Atala Discovery S:
http://catalogo.atala.it/trekking/379-discovery-s-21v-lady.html
Qui la Spillo Rubino:
https://www.bianchi.com/it/bikes/bikes_detail.aspx?rangeIDMaster=382294&categoryIDMaster=382297&bikeIDMaster=383009

Sempre in versione Lady, ma poi non cambia la versione Man (che a volte anche voi donzelle preferite :))
Ciao"
1530,Ecco un aprova
1531,Prova di post con nome strano
1532,"salve, per questa estate vorrei fare il mio primo viaggio in bicicletta da pavia fino al lago d'iseo.
informandomi in giro ,sono venuto a conoscenza che non si puo' campeggiare dove capita.
volevo sapere se esistono dei posti dove si puo' campeggiare liberamente"
1533,"Ciao Leo e grazie  per la donzella ma io son un donzello di nome Marco :lol: ahhh
Beh i consigli vengono buoni anche per la mia fidanzata visto che ne volevo regalare una anche a lei...son indeciso tra olympia e lombardo comunque sabato andrò in un negozio dove hanno tutti e due i marchi e bici di quella fascia per decidere...domanda ma la forcella ammortizzata e' cosi importante??come anche i arrampicata ci sono 100 idee e pensieri quindi essendo un novellino non sai mai a chi dar retta..ahh ti auguro una splendida serata e grazie di tutto"
1534,"Eccomi di nuovo Leo. Mi (ri) unisco alla conversazione dopo un po' di latitanza, durante la quale ho potuto pensare ai tuoi consigli.
Ho abbandonato definitivamente l'opzione trekking. Preferisco non precludermi la possibilità di usare una MTB in percorsi più impegnativi e, in più, mi attira l'idea di cambiare i copertoni per andare su strada e avere l'opportunità di giocare con la mia bici modificandola un po'.
Quindi la mia scelta è MTB 29"". Facendo una ricerca su internet ho trovato alcune bici che forse si equivalgono:

https://www.lombardobikes.com/it/elenco-bici/sestriere-300/
https://www.bottecchia.com/tempolibero/modelli/109-ty500-disk-mechanical-21s-275/
http://catalogo.atala.it/mtb/426-snap-29-21v-md.html
http://catalogo.atala.it/mtb/492-blister.html

Tutte, a parte l'ultima (che non ha i freni a disco), sforano il mio budget. Sulle 29"" vedo che in genere i prezzi salgono.
Pensi sia il caso di rinunciare ai freni a disco o cercare di trovare delle versioni degli anni precedenti (se ci sono) per risparmiare?"
1535,"[quote]Ciao Leo e grazie per la donzella ma io son un donzello di nome Marco :lol: ahhh
Beh i consigli vengono buoni anche per la mia fidanzata visto che ne volevo regalare una anche a lei...son indeciso tra olympia e lombardo comunque sabato andrò in un negozio dove hanno tutti e due i marchi e bici di quella fascia per decidere...domanda ma la forcella ammortizzata e' cosi importante??come anche i arrampicata ci sono 100 idee e pensieri quindi essendo un novellino non sai mai a chi dar retta..ahh ti auguro una splendida serata e grazie di tutto[/quote]

Ahahah... che figuraaaa, scusa!!! Eh che qui si sono sovrapposte un po' di conversazioni e mi sono perso chi è chi :blush: :blush: :blush: 

No, direi che la forcella, se non pensi di farci sentieri o strade davvero dissestate (come mi è parso di capire dai tuoi post precedenti) non è importante ed anzi potrebbe essere un componente in più da manutenere e riparare in caso di rotture. Diverso è il discorso se vuoi una bici che vada bene per un po' tutto e quindi anche per iniziare qualche percorso MTB, ma come sempre dipende moltissimo dalle tue esigenze: se sei sicuro di non voler fare percorsi tecnici, opta per la forcella rigida (e quindi la Taranto potrebbe essere la migliore tra quelle che mi hai presentato).
Se invece pensi che potresti anche provare qualche sentiero con roccette e radici, allora una trekking o MTB base potrebbe essere meglio, magari montando dei copertoni che siano una via di mezzo e prendendo delle ruote da 29"".
Purtroppo spero di non crearti ancor più confusione ma la decisione deve essere tua e devi prima davvero capire come e dove userai la bici.;) ;) ;)"
1536,"[quote=""marco.majortom"" post=1534]Eccomi di nuovo Leo. Mi (ri) unisco alla conversazione dopo un po' di latitanza, durante la quale ho potuto pensare ai tuoi consigli.
Ho abbandonato definitivamente l'opzione trekking. Preferisco non precludermi la possibilità di usare una MTB in percorsi più impegnativi e, in più, mi attira l'idea di cambiare i copertoni per andare su strada e avere l'opportunità di giocare con la mia bici modificandola un po'.
Quindi la mia scelta è MTB 29"". Facendo una ricerca su internet ho trovato alcune bici che forse si equivalgono:

https://www.lombardobikes.com/it/elenco-bici/sestriere-300/
https://www.bottecchia.com/tempolibero/modelli/109-ty500-disk-mechanical-21s-275/
http://catalogo.atala.it/mtb/426-snap-29-21v-md.html
http://catalogo.atala.it/mtb/492-blister.html

Tutte, a parte l'ultima (che non ha i freni a disco), sforano il mio budget. Sulle 29"" vedo che in genere i prezzi salgono.
Pensi sia il caso di rinunciare ai freni a disco o cercare di trovare delle versioni degli anni precedenti (se ci sono) per risparmiare?[/quote]

Ciao Marco,
anch'io quando ho iniziato, ho scelto una MTB utilizzandola con copertoncini slick su strada e per viaggiare quindi può essere una buona opzione che non ti limita poi nei dintorni di casa se vuoi esplorare qualche sentiero.
Detto ciò, scarterei la Blister perché ha una forcella con escursione davvero minima (50mm) e ormai su una MTB almeno i freni a disco meccanici per avere maggior controllo te li consiglio vivamente (questo per rispondere alla tua ultima domanda). Le altre sono tutte molto simili, forse la Sestriere 300 avendo i pignoni fino al 32 è qualcosina meglio ma per il resto direi che vanno tutte bene.
Magari una ricerchina sui mercatini dell'usato di FB o forum vari me la farei per vedere se con la stessa cifra riesci a trovare qualcosa che ha componenti leggermente migliori nella tua zona... secondo me potresti trovare qualche buon affare."
1537,"Ciao Leo,alla fine la Lombardia Taranto sembra dai due fornitori che son andato un po lenta come consegne però uno dei due mi ha fatto un buon prezzo su un olympia citygo con forcella ammortizzata e la olympia college senza forcella ammortizzata..la seconda mi sembra molto uguale alla Taranto..che ne pensi Leo??? Vado per la busta numero uno o numero due ahhh..
Grazie mille di tutto"
1538,"Sì, direi che la college è molto simile alla Lombardo... monta altus anziché acera ma la differenza (a favore del secondo) è minima. Io ti direi, a questo punto, la busta numero due: più semplice ma più solida! ;)"
1539,"Grazie mille Vero, butto un okkio sul link e valuto!! ;)"
1540,"Ciao Leo son la donzella -donzello ahaha,
grazie a te e a quelli come te che aiutano le persone tramite blog e forum e fanno un lavoro fantastico forse oggi non ho preso la mia  prima fregatura.
Son andato ad un negozio a 5 minuti da casa molto grosso avendo scoperto che son rivenditori di olympia,il titolare mi fa vedere olympia college e citygo e poi dopo mi mostra delle bici di loro produzione dicendo che non pagando il marchio si può avere una bici migliore est est...titolare molto insistente che voleva che bloccasi subito la bici altrimenti il prezzo all indomani sarebbe stato senza sconto...decido comunque di non bloccarla e arrivato a casa ricercando in internet mi accorgo che le bici non le fanno loro ma son le cicli daytona
http://www.lombardaciclo.com/wordpress/prodotto/28-onda-uomo-21v/ che son queste e le ho trovato in un altro negozio non lontano a prezzo inferiore....grazie hai vostri consigli non mi son fatto fregare...ma come sta la gente...cmq molto probabilmente prenderò la olympia college o la taranto se si riesce a reperire facilmente e quella con il prezzo migliore...grazie mille leo per tutto ti devo una birra da litro"
1541,"Ciao, da settembre scorso ho adottato una cagnetta (Penny, incrocio whippet/ bracco), ho provato, dopo alcuni mesi, a proporle di viaggiare con me in bicicletta, dapprima piccoli giri, per poi allungare  gradualmente le distanze. Noto che, Penny non si trova a proprio agio a viaggiare nel carrello, non sta mai seduta o distesa,  sta in piedi, appoggiata ad una parete, con la cighietta di sicurezza tirata, mentre lasciata libera corre felice. Chiedo se, insistendo , non si rischi di ottenere un effetto contrario, generando una forma di stess alla bestiola.
Enrico."
1542,"Ciao Luca, grazie per averci scritto.
Riguardo al campeggio libero ti rimando alla risposta già scritta da Leo in un altro topic qui sul forum: https://www.lifeintravel.it/forum/lombardia/1070-accampamento-libero-sentiero-valtellina.html#1446

e aggiungo una piccola nota forse scontata: non lasciamo mai segno del nostro passaggio:))
a presto e buone pedalate,
Vero"
1543,"grazie a te:))
p.s. se soffrite il caldo e volete stare più ad alta quota potreste optare anche per qualcosa di più ""alto"" magari sulle Alpi tipo in Valtellina (Lombardia) facendo, magari partendo da Colico sul lago di Como, la via dei Terrazzamenti (http://www.valtellina.it/it/bike/cicloturismo/percorsi/la-via-dei-terrazzamenti da Morbegno a Tirano), fare un paio di giorni nella Valle di Poschiavo raggiungendo il Passo del Bernina (seguireste un pèo' il tracciato del trenino rosso) e poi rientrare a Colico con il Sentiero Valtellina lungo il fiume Adda^^
tenetici aggiornati ragazzi e buone pedalate,
Vero"
1544,"Ciao Enrico,
questo credo sia uno dei problemi più comuni del viaggiare con il cane ed anche Nala non ama affatto il carrellino. Anche noi ci siamo posti spesso questa domanda senza riuscire a darci una risposta definitiva. 
Il ragionamento che però facciamo sempre è il seguente: meglio lasciarla a casa da sola e non farla uscire e correre (ogni giorno quando non siamo in viaggio o non usciamo in bici andiamo a fare qualche giretto a piedi, ma è un altro discorso...) o portarla con noi e farla correre il più spesso possibile con noi per poi lasciarla nel carrellino quando proprio non è possibile o è troppo stanca? Noi abbiamo scelto la seconda opzione.
 
Detto questo, Nala quand'era cucciola nel carrellino era molto più irrequieta ed anche lei restava in piedi appoggiata ad una parete mentre ora, dopo circa 2000km percorsi con noi, si sdraia e anche se non è il cane più felice del mondo, per qualche tratto riusciamo a farla restare buona.
Noi abbiamo aggiunto un bel cuscino comodo sul fondo del carrello e la sua copertina per farle associare casa/cuccia
Infine cerchiamo di farla stancare all'inizio dei giri lasciandola libera fuori e comunque di alternare spesso la camminata/corsa fuori dal carrellino a chilometri di pausa nel carrello.
Vedrai che se riuscirai ad essere abbastanza paziente poi anche lei si abituerà... l'alternativa, se non pesa troppo ed è ubbidiente, potrebbe essere quella di mettere una cassa sul portapacchi posteriore come fa un superviaggiatore spagnolo, Pablo di BikeCanine: https://bikecanine.com/"
1545,"Ciao Carlo, grazie per averci scritto. Seguirai il fiume Elba per il primo tratto del tuo viaggio? Subito mi viene in mente il parco della Boemia svizzera (http://www.czechtourism.com/it/c/bohemian-switzerland-national-park/), un luogo assolutamente incredibile:) Dresda anche è una città davvero piacevole dove ti consiglio di restare almeno un giorno:) ma viaggerai con la tenda o certi alloggi?=)
buona organizzazione del viaggio,
Vero"
1546,"Gentilissimo VERO,
vorrei sapere se esiste un'app nella quale posso CARICARE una certa'AREA  elaborata con altro programma e tracciare i miei percorsi all'interno di questa area... Successivamente SCARICARE LA TRACCIA PERCORSA NELLA'ARA,
Ti ringrazio molto e ti auguro buona giornata"
1547,"Ciao a tutti. Io e mia moglie vorremmo fare un giro della Puglia in bicicletta, partendo da Bari, passando per Nardò ed ritornando a Termoli. Bici MTB con borse e tendina. Durata prevista 12-14 gg (in tutta tranquillità). Siamo di Parma e cercavamo la maniera di arrivare a Nardò con un mezzo pubblico (treno o bus) che ci permettesse di portare le biciclette. Purtroppo ho verificato che con le compagnie bus (Flixbus, Marino) che servono la Puglia dal nord italia non è possibile portare le biciclette, anche ufficialmente la Flixibus dice di si. In realtà bisognerebbe farle passare come bagaglio ingombrante dopo averle smontate e fatte rientrare entro certe misure (difficile); e comunque non è possibile prenotare il trasporto di tale bagaglio ingombrante. Bisogna andare alla partenza del bus ad una data ora e se c'è posto si paga il supplemento per il bagaglio e si carica; altrimenti lo si deve lasciare a terra !!! Praticamente impossibile essere sicuri di partire per una certa data.
Con FFSS si arriva solo a Termoli con biciclette a bordo del treno (e senza smontarle - c'è un vagone biciclette); dopo non ho trovato maniera di proseguire fino a Bari.
Avevo pensato anche di noleggiare un furgone ma le compagnie di autonoleggio non consentono di lasciare il furgone in una città diversa da quella di prelievo (al contrario delle auto).

Chiedo se qualcuno ha avuto qualche esperienza simile o ha qualche suggerimento per riuscire nell'intento.

Grazie in anticipo !! Ciao."
1548,"Ciao Borro, grazie per averci scritto:)
Negli ultimi anni fare distanze con bici al seguito utilizzando un mezzo pubblico è diventato un vero caos...:(
Ad ogni modo ho controllato i treni e da Termoli a Bari Centrale dovresti prendere due regionali diversi (lo so, è pazzesco) cambiando a Foggia. Ho fatto una prova ed entrambi i regionali indicati hanno il trasporto bici (ne esistono pochissimi... alle 13:04 e alle 17:21!). Una possibile alternativa, noi l'avevamo usata da Matera fino a Milano, è Marino bus che ci aveva caricato le bici con un piccolo extra... potresti provare a sentirli per essere sicuro al 100% --> https://www.marinobus.it/ ecco il sito!
Fammi sapere e buone pedalate,
Veronica"
1549,"Ma che tristezza... esistono ancora negozianti che pensano che fregando la gente si riesca a campare a lungo?!?
Vabbè dai, per fortuna non ti sei fatto gabbare tu!

Bene dai, alla fine sei riuscito la (o le) bici adatte a te... poi ci farai sapere come ti trovi! Anche perché la birra da litro io vengo a prendermela :):):)"
1550,"Ciao Veronica, e grazie per le informazioni. Avevo già provato a contattare Marino ma non garantisce di prendere a bordo le biciclette; dipende dalla disponibilità nel bagagliaio. Inoltre, nel caso, bisognerebbe smontare le bici per farle rientrare in determinate misure e metterle dentro a sacche specifiche; con MTB è praticamente impossibile.
Verifico bene la possibilità di utilizzare i regionali specifichi che hai indicato; per ora non mollo l'idea di fare questo tour.
Grazie ancora.
FABIO"
1551,"Ciao ragazzi, 
A fine mese dovrei intraprendere il mio primo viaggio (in Corsica, per una settimana) con la mia MTB (Olympia/Cobra), ho già acquistato il portapacchi (Blackburn Portabultos). Sono però veramente indeciso su quale borsa comprare, soprattutto perché non so se tutte le persone che trovo (seguendo naturalmente i consigli che avete dato nella vostra pagina/sito) siano ""compatibili"" per il mio portapacchi. Voi conoscete qualche marca affidabile che potrei utilizzare con quel determinato portapacchi?? Vi ringrazio anticipatamente. Vi seguo sempre, continuate così 
A presto, 
Luca."
1552,"Ciao, mi sto organizzando per girare la Sicilia questo agosto partendo da Napoli con il treno fino ad Agropoli, poi Agropoli Praia a mare (quindi il Cilento) in bici e poi di nuovo treno fino reggio calabria. Da lì traghetto per la Sicilia. Spero di girarla tutta in senso orario. Ma i campeggi li come sono? Si trovano e sono accessibili come prezzo? campeggio libero lo sconsigliate? Questo sarà il mio primo viaggio in bici"
1553,"grande, sono certa che, anche se complesso, con i treni si riesce ad arrivare... armatevi solo di grande pazienza:)
buone pedalate
Vero"
1554,"Ciao Gianni, grazie per averci scritto. Icampeggi in Sicilia ci sono lungo la costa quindi se percorrerai il perimetro, bene o male, li troverai sempre (basta fare una ricerca su google "" campeggi in Sicilia"" e guardare la mappa per individuarne la posizione precisa!). Beh per essere accessibili come prezzo direi di si poi dipende sempre dal termine di confronto:) Rispetto al Trentino sono molto più economici, come servizi conviene guardare camping per camping per vedere se dispongono di quello che stai cercando:) Campeggio libero in agosto lungo la costa lo sconsiglierei a meno che tu non sia in luoghi molto remoti... ma l'affluenza turistica di agosto è sempre molto elevata. Mi raccomando di viaggiare sempre con scorte di acqua... la Sicilia in agosto rischia di essere  un forno@@ Sono certa che sarà un viaggio bellissimo, buone pedelate
Veronica"
